{
  "nodes": [
    {
      "node_id": "dk-brondby-test-001",
      "name": "P4P Test Pizzeria",
      "location": {
        "lat": 55.6517,
        "lng": 12.4126
      },
      "country": "DK",
      "city": "Brondby",
      "categories": ["pizza", "kebab"],
      "endpoint": "https://test-pizzeria.example.com/p4p",
      "open": true,
      "order_mode": "test",
      "modules": [],
      "node_public_key": "ed25519:example-public-key",
      "signed_at": "2026-04-30T18:00:00Z",
      "signature": "ed25519:example-signature",
      "protocol_version": "0.1",
      "last_seen": "2026-04-30T18:00:00Z",
      "distance_km": 1.4,
      "source_kind": "local",
      "source_discovery_basis": "local_registry",
      "directory_claims": ["reviewed", "verified"],
      "directory_reason": "Checked by local trust group",
      "directory_set_by": "trust-group",
      "directory_set_at": "2026-04-30T18:08:00Z",
      "trust_claims": ["reviewed"],
      "trust_claim_issuers": ["https://trust.protocols4people.com"]
    }
  ],
  "registry_version": "0.1",
  "query_time": "2026-04-30T18:10:00Z",
  "registry_metadata": {
    "registry_type": "country",
    "capabilities": {
      "can_onboard_nodes": true,
      "can_relay_sources": true,
      "can_curate_active_index": true,
      "can_moderate_directory": true,
      "can_issue_trust_claims": false,
      "can_reexport_sources": false
    },
    "scope": {
      "vertical_id": "pizza4people",
      "country_code": "DK"
    },
    "delegated_by_registry_url": "https://umbrella.protocols4people.com"
  }
}
